{
  "version": "gatemole.run_event.v0",
  "id": "event:demo-001:1",
  "run_id": "run:demo-001",
  "sequence": 1,
  "type": "run.created",
  "actor": {
    "id": "human:fixture-owner",
    "kind": "human",
    "issuer": "https://example.invalid"
  },
  "occurred_at": "2026-07-23T00:00:00Z",
  "payload": {
    "run": {
      "version": "gatemole.agent_run.v0",
      "id": "run:demo-001",
      "namespace": "fixture",
      "image_digest": "sha256:aaaaaaaaaaaaaaaaaaaaaaaaaaaaaaaaaaaaaaaaaaaaaaaaaaaaaaaaaaaaaaaa",
      "contract_digest": "sha256:dddddddddddddddddddddddddddddddddddddddddddddddddddddddddddddddd",
      "principal": {
        "id": "run:demo-001",
        "kind": "run",
        "issuer": "vouchd"
      },
      "delegation_chain": [
        {
          "id": "human:fixture-owner",
          "kind": "human",
          "issuer": "https://example.invalid"
        }
      ],
      "state": "created",
      "priority": 100,
      "deadline": "2026-07-24T00:00:00Z",
      "budget_limits": {
        "max_input_tokens": 100000,
        "max_output_tokens": 50000,
        "max_model_calls": 100,
        "max_tool_calls": 500,
        "max_cost_micros": 5000000,
        "max_wall_time_seconds": 3600
      },
      "budget_usage": {
        "input_tokens": 0,
        "output_tokens": 0,
        "model_calls": 0,
        "tool_calls": 0,
        "cost_micros": 0,
        "wall_time_seconds": 0
      },
      "workspace": "workspace",
      "capability_ids": [],
      "outstanding_approval_ids": [],
      "event_sequence": 1,
      "created_at": "2026-07-23T00:00:00Z",
      "updated_at": "2026-07-23T00:00:00Z"
    }
  },
  "digest": "sha256:ffffffffffffffffffffffffffffffffffffffffffffffffffffffffffffffff"
}
